{
  "schema_version": 2,
  "version": "2026-10-29.2",
  "policy_defaults": {
    "hop_seconds": 57600,
    "max_change": "1.20",
    "operating_cadence_seconds": 86400
  },
  "primes": [
    {
      "id": "grove",
      "name": "Grove",
      "skyeco_url": "https://financial.skyeco.com/primes/grove",
      "tracks": [
        {
          "id": "grove-basin-jtrsy",
          "onchain_source": {"chain_id": 1, "module_id": "grove-mainnet"},
          "skyeco_url": "https://forum.skyeco.com/t/august-27-2026-proposed-changes-to-grove-for-upcoming-spell/28164/7",
          "name": "JTRSY Basin",
          "facet": "BasinFacet",
          "instance": "JTRSY Grove Basin",
          "kind": "instance",
          "plan_note": "Historical phase requirements remain in the reviewed plan. The linked Skyeco record documents approved changes; actual onchain values appear below for comparison.",
          "rate_limit_metadata": [
            {
              "label": "LIMIT_BASIN_DEPOSIT_USDS_JTRSY",
              "decimals": 18
            }
          ],
          "exposure_source": {
            "kind": "rrc_allocation",
            "url": "https://sky.data.blockanalitica.com/internal/rrc/primes/grove/allocations/?limit=100",
            "token_address": "0xf08943f817e1f902debc884c7b19ea5764594ac9",
            "wallet_address": "0x0dcd9298e163dfd3c0b5b00f0d9093c36e40a153"
          },
          "sources": [
            {
              "label": "JTRSY Basin ramp-up plan",
              "url": "https://docs.google.com/document/d/1-Sb3-8927E7iigTKpAzMNKEBAb0jUmmeryqI3glxYRA/edit?tab=t.0",
              "visibility": "restricted"
            },
            {
              "label": "Grove August 27 governance thread",
              "url": "https://forum.skyeco.com/t/august-27-2026-proposed-changes-to-grove-for-upcoming-spell/28164/7",
              "visibility": "public"
            },
            {
              "label": "Grove cBEAM approved targets and execution record — September 3–18, 2026",
              "url": "https://forum.skyeco.com/t/grove-cbeam-configuration/28216",
              "visibility": "public"
            }
          ],
          "phases": [
            {
              "id": "phase-1",
              "name": "Phase 1",
              "earliest_transition": "2026-06-22",
              "minimum_exposure_usd": 1000000,
              "minimum_exposure_days": 14,
              "requirements": [
                "Complete the initial Basin and DPAU mechanics testing period.",
                "Perform every available Basin and DPAU operation.",
                "Review and test the circuit breaker setup.",
                "Confirm final legal binding terms, including an approximately five-business-day wind-down and allocation of responsibilities and claims.",
                "Enable BA Labs monitoring of trades, allocations, fees, and the JTRSY Basin module."
              ],
              "dc_iam": {
                "duty": 0,
                "max_line_usd": 5000000,
                "gap_usd": 1000000,
                "ttl_seconds": 86400
              },
              "offchain": {
                "crr_percent": 100,
                "maximum_exposure_usd": 2500000
              },
              "rate_limit_targets": [
                {
                  "label": "LIMIT_BASIN_DEPOSIT_USDS_JTRSY",
                  "max_amount_usd": 5000000,
                  "slope_per_day_usd": 5000000
                },
                {
                  "label": "LIMIT_BASIN_WITHDRAW_USDS_JTRSY",
                  "max_amount_usd": "unlimited",
                  "slope_per_day_usd": 0
                },
                {
                  "label": "LIMIT_BASIN_WITHDRAW_USDC_JTRSY",
                  "max_amount_usd": "unlimited",
                  "slope_per_day_usd": 0
                }
              ]
            },
            {
              "id": "phase-2",
              "name": "Phase 2",
              "earliest_transition": "2026-08-13",
              "transition_window_end": "2026-08-17",
              "minimum_exposure_usd": 4000000,
              "minimum_exposure_days": 14,
              "dc_iam": {
                "duty": 0,
                "max_line_usd": 10000000,
                "gap_usd": 2000000,
                "ttl_seconds": 86400
              },
              "offchain": {
                "crr_percent": 25,
                "maximum_exposure_usd": 5000000
              },
              "rate_limit_targets": [
                {
                  "label": "LIMIT_BASIN_DEPOSIT_USDS_JTRSY",
                  "max_amount_usd": 5000000,
                  "slope_per_day_usd": 5000000
                },
                {
                  "label": "LIMIT_BASIN_WITHDRAW_USDS_JTRSY",
                  "max_amount_usd": "unlimited",
                  "slope_per_day_usd": 0
                },
                {
                  "label": "LIMIT_BASIN_WITHDRAW_USDC_JTRSY",
                  "max_amount_usd": "unlimited",
                  "slope_per_day_usd": 0
                }
              ]
            },
            {
              "id": "phase-3",
              "name": "Phase 3",
              "earliest_transition": "2026-08-27",
              "transition_window_end": "2026-08-31",
              "minimum_exposure_usd": 10000000,
              "minimum_exposure_days": 14,
              "dc_iam": {
                "duty": 0,
                "max_line_usd": 25000000,
                "gap_usd": 5000000,
                "ttl_seconds": 86400
              },
              "offchain": {
                "crr_percent": 10,
                "maximum_exposure_usd": 12500000
              },
              "rate_limit_targets": [
                {
                  "label": "LIMIT_BASIN_DEPOSIT_USDS_JTRSY",
                  "max_amount_usd": 5000000,
                  "slope_per_day_usd": 5000000
                },
                {
                  "label": "LIMIT_BASIN_WITHDRAW_USDS_JTRSY",
                  "max_amount_usd": "unlimited",
                  "slope_per_day_usd": 0
                },
                {
                  "label": "LIMIT_BASIN_WITHDRAW_USDC_JTRSY",
                  "max_amount_usd": "unlimited",
                  "slope_per_day_usd": 0
                }
              ]
            },
            {
              "id": "phase-4",
              "name": "Phase 4",
              "earliest_transition": "2026-09-10",
              "transition_window_end": "2026-09-14",
              "minimum_exposure_usd": 33000000,
              "minimum_exposure_days": 14,
              "dc_iam": {
                "duty": 0,
                "max_line_usd": 100000000,
                "gap_usd": 15000000,
                "ttl_seconds": 43200
              },
              "offchain": {
                "crr_percent": 1.5,
                "maximum_exposure_usd": 50000000
              },
              "rate_limit_targets": [
                {
                  "label": "LIMIT_BASIN_DEPOSIT_USDS_JTRSY",
                  "max_amount_usd": 15000000,
                  "slope_per_day_usd": 15000000
                },
                {
                  "label": "LIMIT_BASIN_WITHDRAW_USDS_JTRSY",
                  "max_amount_usd": "unlimited",
                  "slope_per_day_usd": 0
                },
                {
                  "label": "LIMIT_BASIN_WITHDRAW_USDC_JTRSY",
                  "max_amount_usd": "unlimited",
                  "slope_per_day_usd": 0
                }
              ]
            },
            {
              "id": "phase-5",
              "name": "Phase 5",
              "earliest_transition": "2026-09-24",
              "transition_window_end": "2026-09-28",
              "minimum_exposure_usd": 100000000,
              "minimum_exposure_days": 14,
              "dc_iam": {
                "duty": 0,
                "max_line_usd": 500000000,
                "gap_usd": 25000000,
                "ttl_seconds": 43200
              },
              "offchain": {
                "crr_percent": 0.5,
                "maximum_exposure_usd": 500000000
              },
              "rate_limit_targets": [
                {
                  "label": "LIMIT_BASIN_DEPOSIT_USDS_JTRSY",
                  "max_amount_usd": 50000000,
                  "slope_per_day_usd": 50000000
                },
                {
                  "label": "LIMIT_BASIN_WITHDRAW_USDS_JTRSY",
                  "max_amount_usd": "unlimited",
                  "slope_per_day_usd": 0
                },
                {
                  "label": "LIMIT_BASIN_WITHDRAW_USDC_JTRSY",
                  "max_amount_usd": "unlimited",
                  "slope_per_day_usd": 0
                }
              ]
            },
            {
              "id": "phase-6",
              "name": "Phase 6 · tentative reference",
              "tentative": true,
              "parameters_tbd": true,
              "earliest_transition": "2026-10-08",
              "transition_window_end": "2026-10-12",
              "minimum_exposure_usd": 0,
              "requirements": [
                "Final JTRSY-specific phase; further increases require a new Prime proposal and risk review.",
                "The source marks these Phase 6 parameters as tentative and subject to Prime proposal and risk review."
              ],
              "dc_iam": {
                "duty": 0,
                "max_line_usd": 1500000000,
                "gap_usd": 150000000,
                "ttl_seconds": 86400
              },
              "offchain": {
                "crr_percent": 0.5,
                "maximum_exposure_usd": 1500000000
              },
              "rate_limit_targets": [
                {
                  "label": "LIMIT_BASIN_DEPOSIT_USDS_JTRSY",
                  "max_amount_usd": 50000000,
                  "slope_per_day_usd": 50000000
                },
                {
                  "label": "LIMIT_BASIN_WITHDRAW_USDS_JTRSY",